{
  "$schema": "https://vomaste.cz/schemas/canonical/claim.schema.json",
  "schemaVersion": 1,
  "@context": "https://vomaste.cz/context/v1.jsonld",
  "@id": "https://vomaste.cz/id/dossiers/lubomir-metnar/claims/CLM-13",
  "@type": "vomaste:Claim",
  "recordType": "claim",
  "identifier": "CLM-13",
  "dossier": {
    "@id": "https://vomaste.cz/id/dossiers/lubomir-metnar"
  },
  "text": "Ministr vnitra Lubomír Metnar své zdůvodnění shrnul slovy: „Návrh nevychází z politického rozhodnutí, ale z bezpečnostní analýzy Policie ČR a z aktuálního vyhodnocení ochrany státních objektů.“",
  "status": "status-quote",
  "statusLabel": "CITACE",
  "sources": [
    {
      "@id": "https://vomaste.cz/id/dossiers/lubomir-metnar/sources/SRC-03"
    }
  ],
  "subjects": [
    "metnar"
  ],
  "order": 13,
  "content": [
    {
      "type": "markdown",
      "value": "Viz plné znění, kontext a sousední tvrzení v [hlavním přehledu](@/dossiers/lubomir-metnar/_index.md#registr-tvrzeni)."
    }
  ]
}
