{
  "$schema": "https://vomaste.cz/schemas/canonical/claim.schema.json",
  "schemaVersion": 1,
  "@context": "https://vomaste.cz/context/v1.jsonld",
  "@id": "https://vomaste.cz/id/dossiers/jaromir-zuna/claims/CLM-50",
  "@type": "vomaste:Claim",
  "recordType": "claim",
  "identifier": "CLM-50",
  "dossier": {
    "@id": "https://vomaste.cz/id/dossiers/jaromir-zuna"
  },
  "text": "Zůna ve Sněmovně uvedl, že rok 2026 počítá s navýšením o 1100 vojáků z povolání a s bytovou výstavbou za více než 3 miliardy korun v osmi posádkách.",
  "status": "status-single",
  "statusLabel": "1 ZDROJ",
  "sources": [
    {
      "@id": "https://vomaste.cz/id/dossiers/jaromir-zuna/sources/SRC-15"
    }
  ],
  "subjects": [
    "zuna"
  ],
  "order": 50,
  "content": [
    {
      "type": "markdown",
      "value": "Viz plné znění, kontext a sousední tvrzení v [hlavním přehledu](@/dossiers/jaromir-zuna/_index.md#registr-tvrzeni)."
    }
  ]
}
