{
  "$schema": "https://vomaste.cz/schemas/canonical/claim.schema.json",
  "schemaVersion": 1,
  "@context": "https://vomaste.cz/context/v1.jsonld",
  "@id": "https://vomaste.cz/id/dossiers/boris-stastny/claims/CLM-30",
  "@type": "vomaste:Claim",
  "recordType": "claim",
  "identifier": "CLM-30",
  "dossier": {
    "@id": "https://vomaste.cz/id/dossiers/boris-stastny"
  },
  "text": "Novým předsedou Národní sportovní agentury byl 26. ledna 2026 jmenován Karel Kovář, dosavadní náměstek ústředního školního inspektora; ministr Šťastný jako jeho hlavní úkol označil kontrolu dotací a stanovení jasných pravidel jejich rozdělování.",
  "status": "status-single",
  "statusLabel": "1 ZDROJ",
  "sources": [
    {
      "@id": "https://vomaste.cz/id/dossiers/boris-stastny/sources/SRC-15"
    }
  ],
  "subjects": [
    "stastny"
  ],
  "order": 30,
  "content": [
    {
      "type": "markdown",
      "value": "Viz plné znění, kontext a sousední tvrzení v [hlavním přehledu](@/dossiers/boris-stastny/_index.md#registr-tvrzeni)."
    }
  ]
}
