{
  "$schema": "https://vomaste.cz/schemas/canonical/claim.schema.json",
  "schemaVersion": 1,
  "@context": "https://vomaste.cz/context/v1.jsonld",
  "@id": "https://vomaste.cz/id/dossiers/jaromir-zuna/claims/CLM-13",
  "@type": "vomaste:Claim",
  "recordType": "claim",
  "identifier": "CLM-13",
  "dossier": {
    "@id": "https://vomaste.cz/id/dossiers/jaromir-zuna"
  },
  "text": "Vláda v květnu 2026 vybrala generála Miroslava Hlaváče jako nástupce Karla Řehky ve funkci náčelníka Generálního štábu; ministr obrany Zůna jako jediný člen vlády hlasoval proti, což veřejně potvrdil premiér Babiš.",
  "status": "status-corroborated",
  "statusLabel": "CORROBORATED",
  "sources": [
    {
      "@id": "https://vomaste.cz/id/dossiers/jaromir-zuna/sources/SRC-10"
    },
    {
      "@id": "https://vomaste.cz/id/dossiers/jaromir-zuna/sources/SRC-09"
    },
    {
      "@id": "https://vomaste.cz/id/dossiers/jaromir-zuna/sources/SRC-39"
    }
  ],
  "subjects": [
    "zuna"
  ],
  "order": 13,
  "content": [
    {
      "type": "markdown",
      "value": "Viz plné znění, kontext a sousední tvrzení v [hlavním přehledu](@/dossiers/jaromir-zuna/_index.md#registr-tvrzeni)."
    }
  ]
}
