{
  "$schema": "https://vomaste.cz/schemas/canonical/claim.schema.json",
  "schemaVersion": 1,
  "@context": "https://vomaste.cz/context/v1.jsonld",
  "@id": "https://vomaste.cz/id/dossiers/boris-stastny/claims/CLM-35",
  "@type": "vomaste:Claim",
  "recordType": "claim",
  "identifier": "CLM-35",
  "dossier": {
    "@id": "https://vomaste.cz/id/dossiers/boris-stastny"
  },
  "text": "Odborník na sociální sítě Daniel Dočekal konstatoval, že příspěvek „vykazuje znaky manipulace“.",
  "status": "status-quote",
  "statusLabel": "CITACE",
  "sources": [
    {
      "@id": "https://vomaste.cz/id/dossiers/boris-stastny/sources/SRC-16"
    }
  ],
  "subjects": [
    "stastny"
  ],
  "order": 35,
  "content": [
    {
      "type": "markdown",
      "value": "Viz plné znění, kontext a sousední tvrzení v [hlavním přehledu](@/dossiers/boris-stastny/_index.md#registr-tvrzeni)."
    }
  ]
}
