{
  "$schema": "https://vomaste.cz/schemas/canonical/claim.schema.json",
  "schemaVersion": 1,
  "@context": "https://vomaste.cz/context/v1.jsonld",
  "@id": "https://vomaste.cz/id/dossiers/andrej-babis/claims/CLM-37",
  "@type": "vomaste:Claim",
  "recordType": "claim",
  "identifier": "CLM-37",
  "dossier": {
    "@id": "https://vomaste.cz/id/dossiers/andrej-babis"
  },
  "text": "Podle údajů z majetkového přiznání podávaného do 30. června 2026 dostal Andrej Babiš v roce 2025 od Agrofertu dividendu 5 miliard korun v hrubém, po zdanění 4,25 miliardy, a to před vložením akcií holdingu do svěřenského fondu RSVP Trust v únoru 2026; výplata dividendy akcionáři je legální krok a citovaný zdroj netvrdí nic jiného",
  "status": "status-single",
  "statusLabel": "1 ZDROJ",
  "sources": [
    {
      "@id": "https://vomaste.cz/id/dossiers/andrej-babis/sources/SRC-15"
    }
  ],
  "subjects": [],
  "order": 37,
  "content": [
    {
      "type": "markdown",
      "value": "Viz plné znění, kontext a sousední tvrzení v [hlavním přehledu](@/dossiers/andrej-babis/_index.md#registr-tvrzeni)."
    }
  ]
}
