{
  "$schema": "https://vomaste.cz/schemas/canonical/claim.schema.json",
  "schemaVersion": 1,
  "@context": "https://vomaste.cz/context/v1.jsonld",
  "@id": "https://vomaste.cz/id/dossiers/karel-havlicek/claims/CLM-07",
  "@type": "vomaste:Claim",
  "recordType": "claim",
  "identifier": "CLM-07",
  "dossier": {
    "@id": "https://vomaste.cz/id/dossiers/karel-havlicek"
  },
  "text": "FORUM 24 v lednu 2021 kritizovalo, že ministerstvo průmyslu pod Havlíčkovým vedením 100 milionů korun za toustovou linku iniciativně nevymáhá a Havlíček podle listu „nikam spěchat nebude“; jde o tvrzení citovaného média, nikoli o zjištění soudu či úřadu.",
  "status": "status-single",
  "statusLabel": "1 ZDROJ",
  "sources": [
    {
      "@id": "https://vomaste.cz/id/dossiers/karel-havlicek/sources/SRC-04"
    }
  ],
  "subjects": [
    "havlicek"
  ],
  "order": 7,
  "content": [
    {
      "type": "markdown",
      "value": "Viz plné znění, kontext a sousední tvrzení v [hlavním přehledu](@/dossiers/karel-havlicek/_index.md#registr-tvrzeni)."
    }
  ]
}
