{
  "$schema": "https://vomaste.cz/schemas/canonical/claim.schema.json",
  "schemaVersion": 1,
  "@context": "https://vomaste.cz/context/v1.jsonld",
  "@id": "https://vomaste.cz/id/dossiers/zuzana-mrazova/claims/CLM-54",
  "@type": "vomaste:Claim",
  "recordType": "claim",
  "identifier": "CLM-54",
  "dossier": {
    "@id": "https://vomaste.cz/id/dossiers/zuzana-mrazova"
  },
  "text": "Olga Richterová v rámci interpelace 28. května 2026 navrhla takzvaný „lex Mrázová“ — úpravu, která by politikům ukládala povinnost uvádět užívání obecního bytu v majetkovém přiznání.",
  "status": "status-single",
  "statusLabel": "1 ZDROJ",
  "sources": [
    {
      "@id": "https://vomaste.cz/id/dossiers/zuzana-mrazova/sources/SRC-24"
    }
  ],
  "subjects": [
    "mrazova"
  ],
  "order": 54,
  "content": [
    {
      "type": "markdown",
      "value": "Viz plné znění, kontext a sousední tvrzení v [hlavním přehledu](@/dossiers/zuzana-mrazova/_index.md#registr-tvrzeni)."
    }
  ]
}
