{
  "$schema": "https://vomaste.cz/schemas/canonical/claim.schema.json",
  "schemaVersion": 1,
  "@context": "https://vomaste.cz/context/v1.jsonld",
  "@id": "https://vomaste.cz/id/dossiers/jaromir-zuna/claims/CLM-15",
  "@type": "vomaste:Claim",
  "recordType": "claim",
  "identifier": "CLM-15",
  "dossier": {
    "@id": "https://vomaste.cz/id/dossiers/jaromir-zuna"
  },
  "text": "Bývalý ministr obrany a europoslanec Alexandr Vondra (ODS) prohlásil, že po hlasování proti novému náčelníkovi generálního štábu 'neexistuje jiné čestné řešení než okamžitě rezignovat', protože jmenování náčelníka je podle něj nejdůležitější rozhodnutí, které ministr obrany může ve funkci udělat.",
  "status": "status-quote",
  "statusLabel": "CITACE",
  "sources": [
    {
      "@id": "https://vomaste.cz/id/dossiers/jaromir-zuna/sources/SRC-09"
    }
  ],
  "subjects": [
    "zuna"
  ],
  "order": 15,
  "content": [
    {
      "type": "markdown",
      "value": "Viz plné znění, kontext a sousední tvrzení v [hlavním přehledu](@/dossiers/jaromir-zuna/_index.md#registr-tvrzeni)."
    }
  ]
}
