{
  "$schema": "https://vomaste.cz/schemas/canonical/claim.schema.json",
  "schemaVersion": 1,
  "@context": "https://vomaste.cz/context/v1.jsonld",
  "@id": "https://vomaste.cz/id/dossiers/tunde-bartha/claims/CLM-05",
  "@type": "vomaste:Claim",
  "recordType": "claim",
  "identifier": "CLM-05",
  "dossier": {
    "@id": "https://vomaste.cz/id/dossiers/tunde-bartha"
  },
  "text": "Tünde Bartha podle citovaného zpravodajství uvedla, že bydlí v Průhonicích v objektu společnosti Imoba, která patří premiéru Andreji Babišovi",
  "status": "status-quote",
  "statusLabel": "CITACE",
  "sources": [
    {
      "@id": "https://vomaste.cz/id/dossiers/tunde-bartha/sources/SRC-01"
    },
    {
      "@id": "https://vomaste.cz/id/dossiers/tunde-bartha/sources/SRC-02"
    }
  ],
  "subjects": [
    "bartha"
  ],
  "order": 5,
  "content": [
    {
      "type": "markdown",
      "value": "Viz plné znění, kontext a sousední tvrzení v [hlavním přehledu](@/dossiers/tunde-bartha/_index.md#registr-tvrzeni)."
    }
  ]
}
