{
  "$schema": "https://vomaste.cz/schemas/canonical/claim.schema.json",
  "schemaVersion": 1,
  "@context": "https://vomaste.cz/context/v1.jsonld",
  "@id": "https://vomaste.cz/id/dossiers/zuzana-mrazova/claims/CLM-10",
  "@type": "vomaste:Claim",
  "recordType": "claim",
  "identifier": "CLM-10",
  "dossier": {
    "@id": "https://vomaste.cz/id/dossiers/zuzana-mrazova"
  },
  "text": "Mrázová se na tiskové konferenci 7. 5. 2026 hájila tím, že v době přidělení bytu splňovala podmínky nastavené městem, že s energiemi platila podle svých slov 14–18 tisíc Kč měsíčně a že devět let žila jako samoživitelka (obhajoba citována s atribucí).",
  "status": "status-quote",
  "statusLabel": "CITACE",
  "sources": [
    {
      "@id": "https://vomaste.cz/id/dossiers/zuzana-mrazova/sources/SRC-06"
    },
    {
      "@id": "https://vomaste.cz/id/dossiers/zuzana-mrazova/sources/SRC-11"
    }
  ],
  "subjects": [
    "mrazova"
  ],
  "order": 10,
  "content": [
    {
      "type": "markdown",
      "value": "Viz plné znění, kontext a sousední tvrzení v [hlavním přehledu](@/dossiers/zuzana-mrazova/_index.md#registr-tvrzeni)."
    }
  ]
}
