{
  "$schema": "https://vomaste.cz/schemas/canonical/claim.schema.json",
  "schemaVersion": 1,
  "@context": "https://vomaste.cz/context/v1.jsonld",
  "@id": "https://vomaste.cz/id/dossiers/adam-vojtech/claims/CLM-19",
  "@type": "vomaste:Claim",
  "recordType": "claim",
  "identifier": "CLM-19",
  "dossier": {
    "@id": "https://vomaste.cz/id/dossiers/adam-vojtech"
  },
  "text": "Koaliční SPD žádá revokaci národní očkovací strategie (doporučená dobrovolná očkování proti covidu, HPV a chřipce), která podle Echo24 počítá s náklady 2–3 miliardy Kč; ministr Vojtěch strategii hájí.",
  "status": "status-single",
  "statusLabel": "1 ZDROJ",
  "sources": [
    {
      "@id": "https://vomaste.cz/id/dossiers/adam-vojtech/sources/SRC-11"
    },
    {
      "@id": "https://vomaste.cz/id/dossiers/adam-vojtech/sources/SRC-12"
    }
  ],
  "subjects": [
    "vojtech"
  ],
  "order": 19,
  "content": [
    {
      "type": "markdown",
      "value": "Viz plné znění, kontext a sousední tvrzení v [hlavním přehledu](@/dossiers/adam-vojtech/_index.md#registr-tvrzeni)."
    }
  ]
}
