{
  "$schema": "https://vomaste.cz/schemas/canonical/claim.schema.json",
  "schemaVersion": 1,
  "@context": "https://vomaste.cz/context/v1.jsonld",
  "@id": "https://vomaste.cz/id/dossiers/zuzana-mrazova/claims/CLM-08",
  "@type": "vomaste:Claim",
  "recordType": "claim",
  "identifier": "CLM-08",
  "dossier": {
    "@id": "https://vomaste.cz/id/dossiers/zuzana-mrazova"
  },
  "text": "Na dotazy novinářů Seznam Zpráv k okolnostem nepravomocné pokuty Mrázová podle záznamu rozhovoru během přibližně šesti minut desetkrát zopakovala větu „S vámi já se bavit nebudu“.",
  "status": "status-quote",
  "statusLabel": "CITACE",
  "sources": [
    {
      "@id": "https://vomaste.cz/id/dossiers/zuzana-mrazova/sources/SRC-02"
    },
    {
      "@id": "https://vomaste.cz/id/dossiers/zuzana-mrazova/sources/SRC-08"
    }
  ],
  "subjects": [
    "mrazova"
  ],
  "order": 8,
  "content": [
    {
      "type": "markdown",
      "value": "Viz plné znění, kontext a sousední tvrzení v [hlavním přehledu](@/dossiers/zuzana-mrazova/_index.md#registr-tvrzeni)."
    }
  ]
}
