{
  "$schema": "https://vomaste.cz/schemas/canonical/claim.schema.json",
  "schemaVersion": 1,
  "@context": "https://vomaste.cz/context/v1.jsonld",
  "@id": "https://vomaste.cz/id/dossiers/richard-chlad/claims/CLM-05",
  "@type": "vomaste:Claim",
  "recordType": "claim",
  "identifier": "CLM-05",
  "dossier": {
    "@id": "https://vomaste.cz/id/dossiers/richard-chlad"
  },
  "text": "Filip Turek podle citovaného zpravodajství uvedl: „Je to můj kamarád a s politikou nemá nic společného, i záměrně přeceňujete jeho roli v podpoře Motoristů.\"",
  "status": "status-quote",
  "statusLabel": "CITACE",
  "sources": [
    {
      "@id": "https://vomaste.cz/id/dossiers/richard-chlad/sources/SRC-03"
    }
  ],
  "subjects": [
    "chlad"
  ],
  "order": 5,
  "content": [
    {
      "type": "markdown",
      "value": "Viz plné znění, kontext a sousední tvrzení v [hlavním přehledu](@/dossiers/richard-chlad/_index.md#registr-tvrzeni)."
    }
  ]
}
