{
  "$schema": "https://vomaste.cz/schemas/canonical/claim.schema.json",
  "schemaVersion": 1,
  "@context": "https://vomaste.cz/context/v1.jsonld",
  "@id": "https://vomaste.cz/id/dossiers/karel-havlicek/claims/CLM-23",
  "@type": "vomaste:Claim",
  "recordType": "claim",
  "identifier": "CLM-23",
  "dossier": {
    "@id": "https://vomaste.cz/id/dossiers/karel-havlicek"
  },
  "text": "Dotace byla vyplacena v plné výši z rozpočtu České republiky, protože Evropská komise ji ČR po auditu neproplatila — ztráta tak jde k tíži českého státního rozpočtu.",
  "status": "status-corroborated",
  "statusLabel": "CORROBORATED",
  "sources": [
    {
      "@id": "https://vomaste.cz/id/dossiers/karel-havlicek/sources/SRC-13"
    },
    {
      "@id": "https://vomaste.cz/id/dossiers/karel-havlicek/sources/SRC-14"
    }
  ],
  "subjects": [
    "havlicek"
  ],
  "order": 23,
  "content": [
    {
      "type": "markdown",
      "value": "Viz plné znění, kontext a sousední tvrzení v [hlavním přehledu](@/dossiers/karel-havlicek/_index.md#registr-tvrzeni)."
    }
  ]
}
