{
  "$schema": "https://vomaste.cz/schemas/canonical/claim.schema.json",
  "schemaVersion": 1,
  "@context": "https://vomaste.cz/context/v1.jsonld",
  "@id": "https://vomaste.cz/id/dossiers/karel-havlicek/claims/CLM-03",
  "@type": "vomaste:Claim",
  "recordType": "claim",
  "identifier": "CLM-03",
  "dossier": {
    "@id": "https://vomaste.cz/id/dossiers/karel-havlicek"
  },
  "text": "Havlíček v prosinci 2019 odmítl závěr auditu Evropské komise, že je premiér Babiš ve střetu zájmů („V tom s vámi úplně nesouhlasím“), a odkazoval na rozdíl mezi českým a evropským právem.",
  "status": "status-quote",
  "statusLabel": "CITACE",
  "sources": [
    {
      "@id": "https://vomaste.cz/id/dossiers/karel-havlicek/sources/SRC-03"
    }
  ],
  "subjects": [
    "havlicek"
  ],
  "order": 3,
  "content": [
    {
      "type": "markdown",
      "value": "Viz plné znění, kontext a sousední tvrzení v [hlavním přehledu](@/dossiers/karel-havlicek/_index.md#registr-tvrzeni)."
    }
  ]
}
