{
  "$schema": "https://vomaste.cz/schemas/canonical/claim.schema.json",
  "schemaVersion": 1,
  "@context": "https://vomaste.cz/context/v1.jsonld",
  "@id": "https://vomaste.cz/id/dossiers/adam-vojtech/claims/CLM-36",
  "@type": "vomaste:Claim",
  "recordType": "claim",
  "identifier": "CLM-36",
  "dossier": {
    "@id": "https://vomaste.cz/id/dossiers/adam-vojtech"
  },
  "text": "Podle Vojtěcha je cílem zachovat obecný strop zhruba 50 tisíc Kč na zdravotní benefity a vydělit preventivní programy do zvláštního daňově uznatelného režimu; benefity bez limitu by platily od ledna 2027 a musely by být upraveny kolektivní smlouvou, vnitřním předpisem nebo pracovní smlouvou.",
  "status": "status-single",
  "statusLabel": "1 ZDROJ",
  "sources": [
    {
      "@id": "https://vomaste.cz/id/dossiers/adam-vojtech/sources/SRC-23"
    }
  ],
  "subjects": [
    "vojtech"
  ],
  "order": 36,
  "content": [
    {
      "type": "markdown",
      "value": "Viz plné znění, kontext a sousední tvrzení v [hlavním přehledu](@/dossiers/adam-vojtech/_index.md#registr-tvrzeni)."
    }
  ]
}
